pid,label,creator,source,_date,description,url_original,url_video,attribution,order,layout,collection,thumbnail,manifest,full
ca1,Decolonized Children Texting,Max Johnson Dugan,Reddit,2019,A meme shared on the r/NativeAmerican subreddit.,https://www.reddit.com/r/NativeAmerican/comments/d785aj/is_your_child_texting_about_decolonization/,N/A,,00,ca_archive_item,ca_archive,"/img/derivatives/iiif/images/ca1/full/250,/0/default.jpg",/img/derivatives/iiif/ca1/manifest.json,"/img/derivatives/iiif/images/ca1/full/1140,/0/default.jpg"
ca2,Immigrant Shopkeeper Unwellness Standup,Max Johnson Dugan,Instagram,April 2022,A standup bit making fun and (taking pride in?) the extreme exhaustion of running a small business,https://www.instagram.com/p/Cc0amW8D2Hm/,,@alsalamgrill on Instagram,01,ca_archive_item,ca_archive,"/img/derivatives/iiif/images/ca2/full/250,/0/default.jpg",/img/derivatives/iiif/ca2/manifest.json,"/img/derivatives/iiif/images/ca2/full/1140,/0/default.jpg"
ca3,Arab Social Experiment,Max Johnson Dugan,Instagram,April 2022,A video shared by a German convert,N/A,,,02,ca_archive_item,ca_archive,"/img/derivatives/iiif/images/ca3/full/250,/0/default.jpg",/img/derivatives/iiif/ca3/manifest.json,"/img/derivatives/iiif/images/ca3/full/1140,/0/default.jpg"
ca4,Laughing Voldemort,Max Johnson Dugan,Instagram,February 2022,A video shared of Voldemort laughing with different dubbed languages.,https://www.instagram.com/reel/CZfyjnZgM5M/?utm_medium=copy_link,,,03,ca_archive_item,ca_archive,"/img/derivatives/iiif/images/ca4/full/250,/0/default.jpg",/img/derivatives/iiif/ca4/manifest.json,"/img/derivatives/iiif/images/ca4/full/1140,/0/default.jpg"
ca5,Himalayas Fancam,Max Johnson Dugan,TikTok,April 2022,"A ""fan"" video made for the Himalayas using funny video editing effects",https://www.tiktok.com/@432pa.hp/video/7085459822790888747?lang=en,,@432.pa.hp on TikTok,04,ca_archive_item,ca_archive,"/img/derivatives/iiif/images/ca5/full/250,/0/default.jpg",/img/derivatives/iiif/ca5/manifest.json,"/img/derivatives/iiif/images/ca5/full/1140,/0/default.jpg"
ca6,Immigrant Parent Calculations,Max Johnson Dugan,Instagram,April 2022,A video joking about a first- or second-generation child trying to figure out how their parents afforded success.,https://www.instagram.com/reel/Cc278UUMbJh/?igshid=MDJmNzVkMjY%3D,,@sheikhshack_ on Instagram,05,ca_archive_item,ca_archive,"/img/derivatives/iiif/images/ca6/full/250,/0/default.jpg",/img/derivatives/iiif/ca6/manifest.json,"/img/derivatives/iiif/images/ca6/full/1140,/0/default.jpg"
ca7,Palestinian Running from IDF,Max Johnson Dugan,Instagram,May 2022,A video in which Adnan Barq and other Palestinians are running from IDF soliders violently attacking them in East Jerusalem.,https://www.instagram.com/p/CeOam17rM0t/,,@muslim on Instagram,06,ca_archive_item,ca_archive,"/img/derivatives/iiif/images/ca7/full/250,/0/default.jpg",/img/derivatives/iiif/ca7/manifest.json,"/img/derivatives/iiif/images/ca7/full/1140,/0/default.jpg"
ca8,Soufs Mother's Day Basketball,Max Johnson Dugan,Instagram,May 2022,"""Soufs,"" a Muslim basketball content creator, honors his mother on Mother's Day with a loving and comical video.",https://www.instagram.com/p/CdTP7FMFsCL/,,@soufs_videos on Instagram,07,ca_archive_item,ca_archive,"/img/derivatives/iiif/images/ca8/full/250,/0/default.jpg",/img/derivatives/iiif/ca8/manifest.json,"/img/derivatives/iiif/images/ca8/full/1140,/0/default.jpg"
ca9,Muslim Fraternity Bro,Max Johnson Dugan,Instagram,June 2022,A parodic performance of a Muslim fraternity bro in which typical hypermasculine behavior is merged with Islamic language and names.,https://www.instagram.com/reel/CeYybuMv5nB/?igshid=MDJmNzVkMjY%3D,,@muslim on Instagram,08,ca_archive_item,ca_archive,"/img/derivatives/iiif/images/ca9/full/250,/0/default.jpg",/img/derivatives/iiif/ca9/manifest.json,"/img/derivatives/iiif/images/ca9/full/1140,/0/default.jpg"
ca10,Shein SOS Messages Supercut,Max Johnson Dugan,Instagram,June 2022,A supercut of help us/SOS messages that workers for Shein (a fast fashion company) had snuck into clothing.,https://www.instagram.com/reel/CeW8CA3rLbe/?igshid=MDJmNzVkMjY%3D,,@bbafmagazine on Instagram,09,ca_archive_item,ca_archive,"/img/derivatives/iiif/images/ca10/full/250,/0/default.jpg",/img/derivatives/iiif/ca10/manifest.json,"/img/derivatives/iiif/images/ca10/full/1140,/0/default.jpg"
ca11,A screenshot taken by Lauren Horn Griffin,Max Johnson Dugan,Unknown,March 2023,A screenshot sent by Laurent Horn Griffin to Max Johnson Dugan,N/A,N/A,Lauren Horn Griffin,10,ca_archive_item,ca_archive,"/img/derivatives/iiif/images/ca11/full/250,/0/default.jpg",/img/derivatives/iiif/ca11/manifest.json,"/img/derivatives/iiif/images/ca11/full/1140,/0/default.jpg"
ca12,A slide from Lacin Tutalar's presentation,Max Johnson Dugan,Lacin Tutalar,March 2023,An image of a slide from Latin Tutalar's presentation,N/A,N/A,Lacin Tutalar,11,ca_archive_item,ca_archive,"/img/derivatives/iiif/images/ca12/full/250,/0/default.jpg",/img/derivatives/iiif/ca12/manifest.json,"/img/derivatives/iiif/images/ca12/full/1140,/0/default.jpg"
